{
    "PeaktableParameters": {
        "filepath": "tests/test_data/test.peak_table_quant_full.csv",
        "format": "mzmine3",
        "polarity": "positive"
    },
    "MsmsParameters": {
        "filepath": "tests/test_data/test.msms.mgf",
        "format": "mgf",
        "rel_int_from": 0.01
    },
    "PhenotypeParameters": {
        "filepath": "tests/test_data/test.bioactivity.qualitative.csv",
        "format": "qualitative"
    },
    "GroupMetadataParameters": {
        "filepath": "tests/test_data/test.group_metadata.csv",
        "format": "fermo"
    },
    "SpecLibParameters": {
        "dirpath": "tests/test_data/spec_lib/",
        "format": "mgf"
    },
    "MS2QueryResultsParameters": {
        "filepath": "tests/test_data/test.ms2query_results.csv",
        "score_cutoff": 0.7
    },
    "AsResultsParameters": {
        "directory_path": "tests/test_data/JABTEZ000000000.1/",
        "similarity_cutoff": 0.7
    },
    "AdductAnnotationParameters": {
        "activate_module": true,
        "mass_dev_ppm": 10.0
    },
    "NeutralLossParameters": {
        "activate_module": true,
        "mass_dev_ppm": 10.0
    },
    "FragmentAnnParameters": {
        "activate_module": true,
        "mass_dev_ppm": 10.0
    },
    "SpecSimNetworkCosineParameters": {
        "activate_module": true,
        "msms_min_frag_nr": 5,
        "fragment_tol": 0.1,
        "score_cutoff": 0.7,
        "max_nr_links": 10
    },
    "SpecSimNetworkDeepscoreParameters": {
        "activate_module": true,
        "score_cutoff": 0.8,
        "max_nr_links": 10,
        "msms_min_frag_nr": 5
    },
    "FeatureFilteringParameters": {
        "activate_module": true,
        "filter_rel_int_range_min": 0.1,
        "filter_rel_int_range_max": 1.0,
        "filter_rel_area_range_min": 0.1,
        "filter_rel_area_range_max": 1.0
    },
    "BlankAssignmentParameters": {
        "activate_module": true,
        "factor": 10,
        "algorithm": "mean",
        "value": "area"
    },
    "GroupFactAssignmentParameters": {
        "activate_module": true,
        "algorithm": "mean",
        "value": "area"
    },
    "PhenoQualAssgnParameters": {
        "activate_module": true,
        "factor": 5,
        "algorithm": "minmax",
        "value": "area",
        "p_val_cutoff": 0.05
    },
    "PhenoQuantPercentAssgnParameters": {
        "activate_module": false,
        "sample_avg": "mean",
        "value": "area",
        "fdr_corr": "bonferroni",
        "algorithm": "pearson",
        "p_val_cutoff": 0.05,
        "coeff_cutoff": 0.7
    },
    "PhenoQuantConcAssgnParameters": {
        "activate_module": false,
        "sample_avg": "mean",
        "value": "area",
        "fdr_corr": "bonferroni",
        "algorithm": "pearson",
        "p_val_cutoff": 0.05,
        "coeff_cutoff": 0.7
    },
    "SpectralLibMatchingCosineParameters": {
        "activate_module": true,
        "fragment_tol": 0.1,
        "min_nr_matched_peaks": 5,
        "score_cutoff": 0.7,
        "max_precursor_mass_diff": 600
    },
    "SpectralLibMatchingDeepscoreParameters": {
        "activate_module": true,
        "score_cutoff": 0.8,
        "max_precursor_mass_diff": 600
    },
    "AsKcbCosineMatchingParameters": {
        "activate_module": true,
        "fragment_tol": 0.1,
        "min_nr_matched_peaks": 5,
        "score_cutoff": 0.5,
        "max_precursor_mass_diff": 600
    },
    "AsKcbDeepscoreMatchingParameters": {
        "activate_module": true,
        "score_cutoff": 0.7,
        "max_precursor_mass_diff": 600
    }
}
